[
  {
    "id": "airframe-document",
    "source": "airframe-document.png",
    "alt": "Airframe asking whether to keep a raw Blackbox log in an Airframe document while leaving the original file unchanged",
    "caption": "The raw log stays unchanged; the Airframe document keeps the work around it.",
    "gallery": "workflow"
  },
  {
    "id": "overview",
    "source": "overview.png",
    "alt": "Airframe Overview showing propeller size, blade count, motor layout, flight-controller configuration, flight facts, and health checks",
    "caption": "Confirm the aircraft context beside the recorded setup evidence before deeper analysis.",
    "gallery": "flight-analysis"
  },
  {
    "id": "current-sensor-calibration",
    "source": "current-sensor-calibration.png",
    "alt": "Airframe Current Sensor Calibration assistant showing a calculated Scale and the path for applying it in Betaflight Configurator",
    "caption": "Calculate the corrected Scale, then apply it deliberately in Betaflight Configurator.",
    "gallery": "workflow"
  },
  {
    "id": "manage-presets",
    "source": "manage-presets.png",
    "alt": "Airframe Manage Presets window listing reusable analysis setups with import, export, rename, and delete controls",
    "caption": "Keep reusable analysis setups organized, portable, and separate from the documents that use them.",
    "gallery": "workflow"
  },
  {
    "id": "graph-playback",
    "source": "graph-playback.png",
    "alt": "Airframe Graph showing gyro, motor and setpoint signals during playback",
    "caption": "Follow recorded signals and craft state on the same timeline.",
    "gallery": "flight-analysis"
  },
  {
    "id": "spectrum",
    "source": "spectrum.png",
    "alt": "Airframe Spectrum view showing frequency energy across a flight",
    "caption": "See where vibration energy lives instead of guessing from a noisy line.",
    "gallery": "tuning"
  },
  {
    "id": "blade-pass-guide",
    "source": "blade-pass-guide.png",
    "alt": "Airframe Frequency vs RPM heatmap with selectable green blade-pass guides in the Guides sidebar",
    "caption": "Compare measured energy ridges with the expected fundamental and higher blade-pass orders as motor RPM changes.",
    "gallery": "tuning"
  },
  {
    "id": "step-response",
    "source": "step-response.png",
    "alt": "Airframe Step Response comparison for roll, pitch and yaw",
    "caption": "Compare commanded and measured motion to spot overshoot and delay.",
    "gallery": "tuning"
  },
  {
    "id": "map",
    "source": "map.png",
    "alt": "Airframe Map showing the recorded flight path",
    "caption": "Put an event back where it happened—not just when.",
    "gallery": "flight-analysis"
  },
  {
    "id": "flight-controller-import",
    "source": "flight-controller-import.png",
    "alt": "Airframe flight controller import sheet",
    "caption": "Bring logs across from the flight controller and get on with the interesting bit.",
    "gallery": "workflow"
  },
  {
    "id": "filter-guides",
    "source": "filter-guides.png",
    "alt": "Airframe Graph with Betaflight filter guide overlays",
    "caption": "Read filter boundaries alongside the signal they are meant to tame.",
    "gallery": "tuning"
  },
  {
    "id": "notch-overlays-lines",
    "source": "notch-overlays-lines.png",
    "alt": "Airframe Frequency versus Throttle spectrum with Dynamic and RPM notch filters selected but collapsed, leaving only their centre lines over the heatmap",
    "caption": "Keep the tracked centres visible without covering the measured spectrum.",
    "gallery": "tuning"
  },
  {
    "id": "notch-overlays-attenuation",
    "source": "notch-overlays-attenuation.png",
    "alt": "The same Airframe spectrum with Dynamic Notch expanded and highlighted, revealing its grey calculated attenuation around the centre track",
    "caption": "Expand and highlight one filter when you want to inspect its calculated attenuation.",
    "gallery": "tuning"
  },
  {
    "id": "chirp-response",
    "source": "chirp-response.png",
    "alt": "Airframe Chirp Response analysis across control axes",
    "caption": "Turn a chirp flight into a readable view of the craft's response.",
    "gallery": "tuning"
  },
  {
    "id": "chirp-spectrogram",
    "source": "chirp-spectrogram.png",
    "alt": "Airframe chirp spectrogram with frequency and time axes",
    "caption": "See how frequency behaviour changes during the sweep.",
    "gallery": "tuning"
  }
]
